Testing: 50/235...
Testing: 100/235...
Testing: 150/235...
Testing: 200/235...
====================================================================================================
COMPREHENSIVE TEST: 235 BASIC FILES
====================================================================================================


====================================================================================================
DETAILED RESULTS BY CATEGORY
====================================================================================================

1. SUCCESSFULLY PARSED: 63 files (26.8%)
2. LEXER ERRORS: 0 files (0.0%)
3. LEXER EXCEPTIONS: 0 files (0.0%)
4. PARSER ERRORS: 172 files (73.2%)
5. PARSER EXCEPTIONS: 0 files (0.0%)
6. FILE ERRORS: 0 files (0.0%)

====================================================================================================
SUCCESSFULLY PARSED FILES (63 files)
====================================================================================================

Filename                       Size     Lines  Stmts  Tokens  Stmt Types
----------------------------------------------------------------------------------------------------
kalfeest.bas                      8003    317    459    2511         15
nim.bas                           9192    233    453    3550         15
sort.bas                          8129    319    436    2568         13
BATTLE.bas                       10222    332    384    2739         20
cpm-pert.bas                     10011    277    372    2597         14
boka&ei.bas                       6142    258    368    2103         13
boka-ei.bas                       6142    258    368    2103         13
blkjk.bas                         5523    237    260    1665         10
timer555.bas                      5586    175    254    1493         16
massa.bas                         4443    165    240    1378         13
testbc2.bas                       5247    128    233    1062         10
HANOI.bas                         3179     99    173    1307         16
feesten.bas                       3219    110    173    1221         16
hanoi.bas                         3199     99    173    1307         16
mortgage.bas                      4712    171    171    1154          9
bacarrat.bas                      3654    142    150    1251         12
astrnmy2.bas                      5461    171    124    1068          5
brutef.bas                        3491     93    104     737         11
benchmk.bas                       1863     90     90     750         11
test.bas                          1395     56     89     510         10
rotate.bas                        2264     49     88     614         11
multiply.bas                      2078     52     87     564         15
atten.bas                         2607     66     82     613          7
add.bas                           2053     52     81     541         15
prime1.bas                        3303     75     77     499         11
bc2.bas                           1742     50     76     512         11
spelling.bas                      2570     52     75     510         15
word.bas                          1839     39     75     595         16
555-ic.bas                        1726     66     69     463         12
multipli.bas                      1653     35     66     440         12
charfreq.bas                      1256     63     64     454         10
RATIO.bas                         1596     38     62     483         13
ratio.bas                         1595     38     62     480         13
567-ic.bas                        1102     50     51     354         12
fills.bas                          697     26     49     235          7
diary.bas                         7893     30     41    1918          9
ykw1.bas                          1845     26     40     554          6
interest.bas                       882     39     39     362          6
rbsclock.bas                      2372     60     39     481          7
unprotct.bas                      1188     35     36     147         10
ykw2.bas                          1830     26     36     548          6
prime2.bas                         809     29     29     178         10
command.bas                        885     34     28     134          5
log10k.bas                        1354     54     16     215          6
rantest.bas                        368     16     16     117         11
maptest.bas                        336     13     13      72          6
fprime.bas                         245     12     12      86          4
qsoedit.bas                       2604     11     11     883          2
pattern1.bas                       650     10     10      31          1
xextract.bas                      1205     10     10     428          4
xscan.bas                         1200     10     10     431          3
pattern.bas                        586      9      9      29          1
pokehi.bas                         148      8      9      61          8
qsofind.bas                        673      6      6     189          4
ucase.bas                          221      6      6      60          5
findctl.bas                        688      2      4     275          2
xlabels.bas                        893      4      4     359          4
xtel.bas                           622      4      4     159          1
sample.bas                         127      1      1       5          1
clock-cb.bas                      7557      0      0    1079          0
convert.bas                       4552      0      0    1070          0
grabcom.bas                        226      0      0      99          0
rocket.bas                           0      0      0       1          0
----------------------------------------------------------------------------------------------------
TOTALS                          178853   4936   6567   50402
AVERAGES                          2838     78    104     800

====================================================================================================
STATEMENT TYPE DISTRIBUTION (across all successful parses)
====================================================================================================

Statement Type                           Count    % of Total
----------------------------------------------------------------------------------------------------
LetStatementNode                            1752      26.7%
PrintStatementNode                          1558      23.7%
IfStatementNode                              647       9.9%
RemarkStatementNode                          591       9.0%
GosubStatementNode                           548       8.3%
GotoStatementNode                            308       4.7%
ForStatementNode                             278       4.2%
NextStatementNode                            271       4.1%
ReturnStatementNode                          225       3.4%
InputStatementNode                           103       1.6%
DataStatementNode                             71       1.1%
EndStatementNode                              34       0.5%
DimStatementNode                              28       0.4%
ReadStatementNode                             25       0.4%
LprintStatementNode                           16       0.2%
ClearStatementNode                            12       0.2%
WidthStatementNode                            12       0.2%
RunStatementNode                              12       0.2%
DefFnStatementNode                            10       0.2%
StopStatementNode                              9       0.1%
OutStatementNode                               9       0.1%
OnErrorStatementNode                           8       0.1%
DefTypeStatementNode                           7       0.1%
OnGosubStatementNode                           6       0.1%
PokeStatementNode                              5       0.1%
OnGotoStatementNode                            4       0.1%
LineInputStatementNode                         4       0.1%
CallStatementNode                              3       0.0%
CloseStatementNode                             3       0.0%
RandomizeStatementNode                         2       0.0%
GetStatementNode                               2       0.0%
WhileStatementNode                             1       0.0%
WendStatementNode                              1       0.0%
OpenStatementNode                              1       0.0%
PutStatementNode                               1       0.0%

====================================================================================================
PARSER ERRORS (172 files)
====================================================================================================

Error Type                                                        Count 
----------------------------------------------------------------------------------------------------
or newline, got IDENTIFIER                                           27
Expected EQUAL, got NUMBER                                           17
Expected EQUAL, got NEWLINE                                          14
BACKSLASH                                                            11
Expected EQUAL, got IDENTIFIER                                       10
NEWLINE                                                               8
Expected IDENTIFIER, got HASH                                         7
EOF_FUNC                                                              6
GREATER_THAN                                                          5
NUMBER                                                                5
Expected EQUAL, got COLON                                             4
Expected THEN or GOTO after IF condition                              4
Expected EQUAL, got STRING                                            3
  → OTHELLO.bas
  → tic.bas
  → tictac.bas
HASH                                                                  3
  → aut850.bas
  → auto850.bas
  → pckexe.bas
HEX                                                                   3
  → disasmb.bas
  → rsj.bas
  → xref.bas
ERASE                                                                 3
  → ozdot.bas
  → qubic.bas
  → stackalc.bas
or newline, got LPAREN                                                3
  → search.bas
  → tab8085.bas
  → tabintel.bas
Expected line number after GOTO                                       2
  → DIVISION.bas
  → division.bas
Expected EQUAL, got PRINT                                             2
  → ONECHECK.bas
  → onecheck.bas
Expected EQUAL, got REM                                               2
  → bibbld.bas
  → vocbld.bas
MID                                                                   2
  → clock-m.bas
  → tanks.bas
Expected EQUAL, got EOF                                               2
  → digiklok.bas
  → tankie.bas
Expected EQUAL, got MINUS                                             2
  → doodle.bas
  → scenecar.bas
Expected IDENTIFIER, got LINE_INPUT                                   2
  → dow.bas
  → sleuth.bas
DEF function name must start with FN                                  2
  → ibmmdm.bas
  → surround.bas
Expected EQUAL, got IF                                                1
  → bibsr2.bas
Expected IDENTIFIER, got HEX                                          1
  → binhex.bas
Expected IDENTIFIER, got BACKSLASH                                    1
  → blast.bas
Expected IDENTIFIER, got SEMICOLON                                    1
  → cpkhex.bas
EQUAL                                                                 1
  → deprec.bas
Expected COMMA, got IDENTIFIER                                        1
  → directio.bas
Expected GOTO or GOSUB after ON expression                            1
  → el-e.bas
Expected EQUAL, got APOSTROPHE                                        1
  → entrbbs.bas
or newline, got THEN                                                  1
  → finance.bas
or newline, got NUMBER                                                1
  → hex2data.bas
or newline, got RPAREN                                                1
  → ic-timer.bas
SAVE                                                                  1
  → krakinst.bas
LPAREN                                                                1
  → lanes.bas
Expected EQUAL, got LESS_THAN                                         1
  → lifscore.bas
LPRINT                                                                1
  → pcat.bas
Expected COMMA, got AS                                                1
  → pckget.bas
COMMA                                                                 1
  → proset.bas
or newline, got COMMA                                                 1
  → sdir.bas
Expected RPAREN, got IDENTIFIER                                       1
  → speech.bas
or newline, got REM                                                   1
  → survival.bas
Expected EQUAL, got GOTO                                              1
  → tricks.bas
PRINT                                                                 1
  → tvigammo.bas
Expected EQUAL, got PLUS                                              1
  → winning.bas

====================================================================================================
WRITING DETAILED RESULTS TO FILES
====================================================================================================
✓ Wrote test_results_success.txt (63 files)
✓ Wrote test_results_lexer_fail.txt (0 files)
✓ Wrote test_results_parser_fail.txt (172 files)

====================================================================================================
FINAL SUMMARY
====================================================================================================

Total files tested: 235
Successfully parsed: 63 (26.8%)
Lexer failures: 0 (0.0%)
Parser failures: 172 (73.2%)

Successfully parsed programs contain:
  - 4,936 lines of code
  - 6,567 statements
  - 50,402 tokens

====================================================================================================
